,Dossier type,Personal household (support unit),Persons in household total,Person category,Marital status,Nationality categories,In CH since birth,Age categories,Employment situation,Degree of employment,Part-time reason,Highest completed education,Trained profession category,last job category
0,Inländer/innen,1,Einzelhaushalt,Alleinstehend,ledig,Schweiz,True,26-35,"ohne Arbeit, nicht beim Arbeitsamt gemeldet",NAN,NAN,obligatorische Schule,kein | keine,kein | keine
1,Inländer/innen,1,Einzelhaushalt,Alleinstehend,geschieden,Schweiz,True,56-65,vorübergehend arbeitsunfähig,NAN,NAN,Berufslehre/-schule,kein | keine,Berufe im Bereich personenbezogener Dienstleistungen
2,Inländer/innen,1,Einzelhaushalt,Alleinstehend,geschieden,Schweiz,True,46-55,vorübergehend arbeitsunfähig,NAN,NAN,Berufslehre/-schule,kein | keine,NAN
3,Ausländer/innen,1,Einzelhaushalt,Alleinstehend,ledig,Afrika,True,26-35,"ohne Arbeit, nicht beim Arbeitsamt gemeldet",NAN,NAN,obligatorische Schule,kein | keine,kein | keine
4,Ausländer/innen,1,Einzelhaushalt,Alleinstehend,geschieden,Restliches Europa,True,36-45,"ohne Arbeit, beim Arbeitsamt gemeldet",NAN,NAN,obligatorische Schule,kein | keine,Berufe im Bereich personenbezogener Dienstleistungen
5,Inländer/innen,1,Einzelhaushalt,Alleinstehend,ledig,Schweiz,True,36-45,NAN,NAN,NAN,NAN,NAN,NAN
6,Inländer/innen,2,Mehrfachhaushalt (2-3),Person mit Kind / Kinder,verheiratet,Schweiz,True,36-45,"ohne Arbeit, nicht beim Arbeitsamt gemeldet",NAN,NAN,obligatorische Schule,kein | keine,Reinigungspersonal und Hilfskräfte
